{
  "schemaVersion": "spine_character_manifest_v2",
  "presentationId": "goblin_story_headhunter",
  "skeletonFile": "goblin_story_headhunter.skel",
  "atlasFile": "goblin_story_headhunter.atlas",
  "texturePages": [
    "goblin_story_headhunter.png"
  ],
  "animations": [
    "idle",
    "attack_light",
    "hit_front",
    "death"
  ],
  "slots": [
    "weapon",
    "shield",
    "fx_front"
  ],
  "anchorProfile": {
    "x": 0.5,
    "y": 1.0
  },
  "scaleProfile": {
    "baseScale": 1.0
  },
  "defaultVariantId": "default",
  "variants": [
    {
      "variantId": "default",
      "label": "Default",
      "skin": "base",
      "enabled": true,
      "allowedAnimations": [
        "idle",
        "attack_light",
        "hit_front",
        "death"
      ],
      "requiredComponents": [
        "slot_body",
        "slot_weapon",
        "slot_head"
      ],
      "anchorProfileOverride": null,
      "scaleProfileOverride": null,
      "resourceOverrides": {},
      "notes": "Default battle loadout."
    },
    {
      "variantId": "festival",
      "label": "Festival Paint",
      "skin": "festival",
      "enabled": true,
      "allowedAnimations": [
        "idle",
        "attack_light"
      ],
      "requiredComponents": [
        "slot_body",
        "slot_weapon"
      ],
      "anchorProfileOverride": null,
      "scaleProfileOverride": null,
      "resourceOverrides": {},
      "notes": "Festival skin keeps weapon and body layers only."
    }
  ]
}
